{
  "$schema": "https://json-schema.org/draft/2020-12/schema",
  "$id": "https://bacp.dev/2026-10-18/schemas/conformance-attestation.json",
  "title": "Conformance attestation payload",
  "description": "The payload of a BACP conformance attestation: a compact JWS, with the JOSE header typ bacp-conformance+jwt, signed by a key of a conformance authority that appears in the public conformance-authority list. It records that the subject passed the listed conformance levels and, for a gateway, which pilot payment handlers it may offer. It is a statement about passing BACP protocol tests. It is not approval, certification or onboarding by NPCI, RBI, ONDC or any public body, and it MUST NOT be presented as such. The payload cannot express these rules, which the conformance cases test: exp is at most 180 days after iat; iss is not operated by the same operator as sub, as the payer PSP named in rail_binding.psp_id or as the issuing Mandate Manager; sub is the subscriber that the signing key of the forwarded request resolves to in the registry.",
  "type": "object",
  "required": [
    "iss",
    "sub",
    "subject_role",
    "scope",
    "iat",
    "exp",
    "jti",
    "bacp_version",
    "registry_version",
    "levels",
    "pilots",
    "manifest_digest",
    "report_digest",
    "status"
  ],
  "properties": {
    "iss": {
      "type": "string",
      "minLength": 1,
      "description": "The conformance authority: the ca_id of the entry in the public conformance-authority list whose key signed this attestation."
    },
    "sub": {
      "type": "string",
      "minLength": 1,
      "description": "The participant that the attestation is about: the gateway's subscriber id, the agent id or the Mandate Manager's registry id, as subject_role says; for a trusted_surface, the subscriber id of the Mandate Manager or payer PSP that operates it."
    },
    "subject_role": {
      "enum": [
        "gateway",
        "agent",
        "mm",
        "trusted_surface"
      ],
      "description": "What the subject is: gateway, agent, mm (a Mandate Manager) or trusted_surface (the Trusted Surface of a Mandate Manager or a payer PSP, attested at level bacp.ts.1). Only a gateway may list pilot handlers."
    },
    "scope": {
      "const": "bacp-protocol-conformance",
      "description": "Fixed value. It states that the attestation covers BACP protocol conformance and nothing else."
    },
    "iat": {
      "type": "integer",
      "minimum": 0,
      "description": "Issue time, as a NumericDate (seconds since the epoch, RFC 7519 section 4.1.4)."
    },
    "exp": {
      "type": "integer",
      "minimum": 0,
      "description": "Expiry time, as a NumericDate. After it, no verifier may rely on the attestation. It is at most 180 days after iat; a conformance case tests this because JSON Schema cannot compare two fields."
    },
    "jti": {
      "type": "string",
      "pattern": "^[A-Za-z0-9_-]{8,64}$",
      "description": "Unique id of this attestation. A mandate's rail_binding.conformance records it, and a pause for a lapsed attestation logs it."
    },
    "bacp_version": {
      "type": "string",
      "pattern": "^\\d{4}-\\d{2}-\\d{2}$",
      "description": "The dated BACP release (YYYY-MM-DD) whose conformance cases were run."
    },
    "registry_version": {
      "type": "string",
      "pattern": "^\\d{4}-\\d{2}-\\d{2}$",
      "description": "The dated release (YYYY-MM-DD) of the handler registry that the run used."
    },
    "levels": {
      "type": "array",
      "minItems": 1,
      "uniqueItems": true,
      "items": {
        "$ref": "https://bacp.dev/2026-10-18/schemas/common.json#/$defs/ConformanceLevel"
      },
      "description": "The conformance levels passed."
    },
    "pilots": {
      "type": "array",
      "uniqueItems": true,
      "items": {
        "$ref": "https://bacp.dev/2026-10-18/schemas/common.json#/$defs/HandlerId"
      },
      "description": "The canonical ids of the pilot payment handlers whose cases the gateway passed and that it may offer. Empty when there are none, and always empty unless subject_role is gateway. A legacy alias is not a canonical id."
    },
    "manifest_digest": {
      "type": "string",
      "pattern": "^sha-256:[A-Za-z0-9_-]{43}$",
      "description": "Digest of the conformance-case manifest that was run, as sha-256:<base64url>."
    },
    "report_digest": {
      "type": "string",
      "pattern": "^sha-256:[A-Za-z0-9_-]{43}$",
      "description": "Digest of the published, reproducible run report behind this attestation, as sha-256:<base64url>. The authority's report_uri_template in the public list says where the report is published."
    },
    "status": {
      "$ref": "#/$defs/StatusListRef",
      "description": "Where the attestation's revocation status is published. A Mandate Manager and a gateway refuse issuance and a new complete on a pilot handler when the status is revoked (reason binding_ineligible; at a re-check the mandate is paused) or when their copy of the status list is more than 24 hours old or the list is unreachable (reason attestation_status_stale; recoverable, no pause)."
    }
  },
  "additionalProperties": false,
  "allOf": [
    {
      "if": {
        "required": [
          "subject_role"
        ],
        "properties": {
          "subject_role": {
            "enum": [
              "agent",
              "mm",
              "trusted_surface"
            ]
          }
        }
      },
      "then": {
        "properties": {
          "pilots": {
            "maxItems": 0
          }
        }
      }
    }
  ],
  "$defs": {
    "StatusListRef": {
      "type": "object",
      "required": [
        "status_list"
      ],
      "properties": {
        "status_list": {
          "type": "object",
          "required": [
            "uri",
            "idx"
          ],
          "properties": {
            "uri": {
              "type": "string",
              "format": "uri"
            },
            "idx": {
              "type": "integer",
              "minimum": 0
            }
          },
          "additionalProperties": false
        }
      },
      "additionalProperties": false,
      "description": "The location of a revocation status: a status list uri and the index idx of the entry in it, the same shape as an AgentCredential's status."
    }
  }
}
