{
  "iss": "ca.testlab.example.in",
  "sub": "mm.psp.example.in",
  "subject_role": "trusted_surface",
  "scope": "bacp-protocol-conformance",
  "iat": 1792200000,
  "exp": 1807750000,
  "jti": "att_9Tz4Hn3LcR8s",
  "bacp_version": "2026-10-17",
  "registry_version": "2026-10-17",
  "levels": [
    "bacp.ts.1"
  ],
  "pilots": [],
  "manifest_digest": "sha-256:Zm9vYmFyZm9vYmFyZm9vYmFyZm9vYmFyZm9vYmFyZm8",
  "report_digest": "sha-256:YmF6cXV4YmF6cXV4YmF6cXV4YmF6cXV4YmF6cXV4YmE",
  "status": {
    "status_list": {
      "uri": "https://ca.testlab.example.in/status/attestations/1",
      "idx": 18
    }
  }
}
