{
  "iss": "ca.testlab.example.in",
  "sub": "bap.vaani.example.in",
  "subject_role": "gateway",
  "scope": "bacp-protocol-conformance",
  "iat": 1792200000,
  "exp": 1807750000,
  "jti": "att_7Kd2Qw9XmP4r",
  "bacp_version": "2026-10-17",
  "registry_version": "2026-10-17",
  "levels": [
    "bacp.core.1",
    "bacp.pay.upi.1",
    "bacp.pay.all.1"
  ],
  "pilots": [
    "in.upi.circle"
  ],
  "manifest_digest": "sha-256:Zm9vYmFyZm9vYmFyZm9vYmFyZm9vYmFyZm9vYmFyZm8",
  "report_digest": "sha-256:YmF6cXV4YmF6cXV4YmF6cXV4YmF6cXV4YmF6cXV4YmE",
  "status": {
    "status_list": {
      "uri": "https://ca.testlab.example.in/status/attestations/1",
      "idx": 17
    }
  }
}
